question,Intent_Number
disabled veterans,144
Summer school financial aid,144
how much is tuition?,144
When are students notified about financial aid award decisions? ,144
how does the financial aid package change from year-to-year  less or more,144
how are scholarships applied to your account,144
what is the priority deadline to apply for financial aid ,144
Summer school financial aid eligibility,144
where is financial aid located?,144
when are students notified about financial aid award decisions,144
How do I get rich?,144
how am i billed by the college,144
How do I apply for financial aid?,144
Telephone number ,144
What color is the sky?,144
payment plan,144
I need to email the office,144
scholarships to transfer students,144
"1.	What is the priority deadline to apply for financial aid?",144
Whats bull shti ,144
How will i be billed by the college,144
What's the FAFSA code for UCF?,144
Where is the zoo,144
what day is it,144
meal plans,144
reward amount changed from last year,144
What can i use financial aid money for?,144
what is my RCN,144
residency certificate number,144
Where is the financial aid building?,144
Number ,144
when can we apply for summer aid?,144
what can I use my financial aid for?,144
If I am a spring admit do I have to fill out another FAFSA since I didnlt get in in the fall,144
whats the email for the finacial aid office,144
how much money do I owe the university,144
what is the deadline to apply for financial aid,144
Can transfer students get financial aid,144
When is the priority deadline?,144
when will the financial aid for the 2017 - 2018 school year be posted?,144
How can a parent get access to the student account,144
parent financial account access,144
what forms do I need to fill out to be able to receive my financial aid?,144
Minimum credit hours per summer session needed for financial aid?,144
Does financial aid cover off-campus housing? ,144
How do I complete an MPN for 2016-2017,144
what does that process look like,144
what is Miscellaneous,144
Office hours?,144
Are there transfer student scholarships?,144
Verification of nonfiling ,144
what number do I call for housing ,144
Number for financial aid,144
do financial aid packages change,144
How does the financial aid package change over time,144
how will my aid change over time,144
when will I get the money,144
is there a payment plan?,144
at home means living at home and traveling to school everyday?,144
tuition,144
I can't apply for summer financial aid because I have holds,144
how will you be billed by college,144
payment plans,144
scholarships applied,144
when are scholarships applied,144
do you offer any specific scholarships for transfer students?,144
it is may and I haven't received my financial award yet,144
My question is  if I am international student  could I apply for a scholarship?,144
when do you start awarding financial aid to students ,144
My son will be a sophmore in the Fall at UNCC.  At what point do I apply for loans to cover his 2017-2018 year?,144
what is your email,144
What is my award for 2017,144
what year is it?,144
When will I know that my financial aid has processed at the university?,144
what happens if you dont complete the fastfa package in time ,144
will i pay for the full amount or spread it out through the year,144
When will my award package be posted?,144
How many credit hours for full time,144
I want to check my account balance,144
do u suck dicks,144
How much money do i have to pay per year?,144
What scholarships does your university offer for transfer students or students in your major or program? ,144
bull shit ... Why are you even online if your not going to answer questions ,144
I have a question about section A on the verification worksheet,144
What if you dont submit the package in time,144
Business major schokarships,144
I am trying to ensure i accept my financial aid award and i do not see where to click to accept it,144
How many hours equals full time,144
When will I get my money?,144
I want to apply for Federal Work Study.where do I apply,144
What is the deadline for applying for financial aid,144
what is the deadline for sap appeal,144
when is financial aid dispersed to students,144
financial aid fax numbers,144
How do I apply for short term loan,144
How can I apply?,144
when is the fafsa due?,144
How do I apply for financial aid for second summer semester,144
I am international student,144
what is the deadline for the summer school application,144
What are the colors of the rainbow?,144
how to apply,144
when is my fasfsa due,144
When will my awarded scholarships show in my student account?,144
When is move in ,144
i have a question,145
Who is stronger  Richard or Chuck Norris?,146
Who is stronger  Alicia Keaton or Chuck Norris?,146
chuck norris,146
Kayla Picca is the coolest,147
financial aid is the coolest,147
What is your favorite color?,148
Hi,149
Hey ,149
hi,149
Hello,149
hello,149
Hi there,149
Hi ,149
Hello,149
thank you,150
Thanks,150
Thank you.,150
Thanks!,150
ok,150
Cool thanks,150
Cool. Thanks dude!,150
ok thanks. ,150
Hi  how are you?,151
How are you out of gold nuggets?  ,151
How are you,151
how are you today,151
how old am I,152
How do I become rich?,153
I want to be rich.,153
what is bull shti?,154
what time is it,155
What time is it?,155
what year do i need to turn in,156
Are you a robot?,157
what is fixed tuition?,157
What is tuition DE UG Nonresident,157
whats the average tuition,157
what is the tuition breakdown,157
I have done so  no body has answered,157
what is tuition at uncc,157
Is this automated answers ?,157